topic,query,title,link,snippet,published,world_cup_match,fetched_at,matched_keyword,content,real_link,scrape_error,city,country
Stadium safety / security,"""fifa world cup 2026"" ""bag policy""",SoFi Stadium Bag Policy for FIFA World Cup 2026 - surprisesports,https://news.google.com/rss/articles/CBMigAFBVV95cUxNdlNDV19oM3VIM2w5amc0bF9ZM0JTTEZkM01DRk51ZG94Si1iMzFsSi1lM2xFWGZrZy1BcnotZ2g4d3VRQ19NX1NKcGM5emY2MkJ4bzJWT0VWWWhSNTZTTllDdmV6d1NwSUw3YU5RcjBvS2Z4R0o5NHZpLVlFSWxrQQ?oc=5,"<a href=""https://news.google.com/rss/articles/CBMigAFBVV95cUxNdlNDV19oM3VIM2w5amc0bF9ZM0JTTEZkM01DRk51ZG94Si1iMzFsSi1lM2xFWGZrZy1BcnotZ2g4d3VRQ19NX1NKcGM5emY2MkJ4bzJWT0VWWWhSNTZTTllDdmV6d1NwSUw3YU5RcjBvS2Z4R0o5NHZpLVlFSWxrQQ?oc=5"" target=""_blank"">SoFi Stadium Bag Policy for FIFA World Cup 2026</a>&nbsp;&nbsp;<font color=""#6f6f6f"">surprisesports</font>",2026-03-05,True,2026-03-05 22:58:03.436987,bag policy,"Heading to SoFi Stadium for a Rams game, a concert, or the FIFA World Cup 2026 means knowing exactly what’s allowed through the gates.
The stadium’s clear bag policy stops most people at security, and if your bag doesn’t comply, you’ll either walk back to your car or pay $20 to check it at a valet.
In this guide, you’ll learn what clear bags are permitted, which small clutches work, how to measure your bag correctly, what items are absolutely prohibited, and your options if you arrive with a non-compliant bag.
Quick Reference: Bag Policy Compliance Chart
We’ve researched the official SoFi Stadium rules and the NFL clear bag policy to give you everything you need to pack right and get inside without delays.
|Bag Type||Size Limit||Material||Status||Notes|
|Clear backpack||12″ × 6″ × 12″||Plastic, vinyl, PVC||✅ Allowed||Transparency required|
|Clear fanny pack||12″ × 6″ × 12″||Plastic, vinyl, PVC||✅ Allowed||One-gallon freezer bag alternative|
|Small clutch||4.5″ × 6.5″||Any (opaque OK)||✅ Allowed||Wallet-sized, plus one clear bag|
|Clear diaper bag||12″ × 6″ × 12″||Plastic, vinyl, PVC||✅ Allowed||Subject to inspection|
|Standard backpack||Any||Any||❌ Prohibited||Even if under limit|
|Opaque handbag||Over 4.5″ × 6.5″||Any||❌ Prohibited||Must use valet or leave behind|
|Rolling luggage||Any||Any||❌ Prohibited||Use bag storage nearby|
|Briefcase||Any||Any||❌ Prohibited||Transfer items to clear bag|
SoFi Stadium Clear Bag Policy
SoFi Stadium requires transparent bags so security can see contents without opening them. Permitted clear bags must be plastic, vinyl, or PVC and cannot exceed 12 inches tall by 6 inches wide by 12 inches deep.
This core rule applies to 95% of guests and is non-negotiable.
Bags must be completely see-through with no tint, hologram, patterns, or stickers. Canvas with clear panels doesn’t qualify—the entire bag must be transparent.
Clear Plastic, Vinyl, and PVC Materials
All three approved materials work equally at SoFi. Clear plastic is rigid (makeup organizer style). Vinyl is flexible and weather-resistant.
PVC is durable polyvinyl chloride. Most stadium-goers prefer vinyl or PVC because they fold flat and resist damage.
Avoid canvas, waterproof nylon, or laminated materials. Material must be 100% transparent for instant security inspection.
One-Gallon Clear Freezer Bags
One-gallon clear plastic freezer bags (Ziploc style) are pre-approved. A gallon bag measures roughly 11 by 10.5 inches, fitting under the size limit. Disposable, lightweight, and under $5 per box, they work well for one-time events.
The bag must be completely clear with a functional seal. Test at home to confirm it meets the 12x6x12 standard.
Bag Size Limit: 12″ x 6″ x 12″
This is the most important number: 12 inches by 6 inches by 12 inches. If any dimension exceeds this by even an inch, you cannot bring it inside. Security measures bags at the gate with zero flexibility.
Maximum Dimensions Explained
The 12-inch height accommodates small backpacks and tote bags. The 6-inch width prevents unwieldy bags in crowds.
The 12-inch depth blocks bulky duffel bags. These limits balance security efficiency with practicality—oversized bags create entry choke points and obstruct sightlines.
How to Measure Your Bag
- Height — Stand your bag upright and measure bottom to top, including handles. Round up to the nearest half-inch.
- Width — Measure left to right at the widest point (usually the front opening). This is typically the smallest dimension.
- Depth — Measure front to back. A small-looking bag often measures deeper than expected.
Use your phone’s measurement app or physical ruler. A five-minute confirmation beats walking back to your car.
SoFi Stadium Policy: Prohibited Items
Security enforces the prohibited list strictly. Violating it means denied entry with no exceptions. The list includes all bags larger than allowed plus specific safety risks.
Backpacks, Coolers, and Luggage
Traditional backpacks are prohibited even if clear and undersized. A typical hiking backpack measures 16x10x8 inches minimum, exceeding the width and depth limits.
Coolers of any kind (hard or soft-sided) are banned. Luggage, duffel bags, and suitcases are completely prohibited. Store airport luggage at nearby facilities; SoFi doesn’t hold items overnight.
Non-Clear Purses and Briefcases
Non-clear purses larger than the 4.5×6.5-inch exception are prohibited. A typical handbag (8x10x4 inches) won’t be allowed.
Briefcases, work bags, fanny packs, crossbody bags, cinch bags, and camera bags over the size limit are all banned. Transfer documents to a compliant clutch or clear bag instead.
Bag Exceptions and Allowances
The clear bag rule has exactly three exceptions, and each requires specific conditions. Understanding when exceptions apply saves time and prevents arguments at security.
Small Clutches and Fanny Packs (4.5″ x 6.5″)
The single biggest exception to the clear bag rule is small non-clear clutches and fanny packs measuring no more than 4.5 inches by 6.5 inches. This is your loophole for a real purse or wallet.
A 4.5×6.5-inch clutch holds a phone, keys, credit cards, and ID with minimal extra space. Most designer crossbody bags and formal clutches fit comfortably within these dimensions. The key detail: measurements include the handle and strap, not just the bag body.
You can bring one small clutch in addition to your clear bag. This means one clear 12x6x12 bag plus one non-clear clutch up to 4.5×6.5. You cannot bring two clear bags or two clutches.
Fanny packs and hip bags under 4.5×6.5 inches are permitted. Many fans prefer small fanny packs over clutches because they’re hands-free and fit snugly at the waist. The same size restriction applies.
Medically Necessary Bags and Diaper Bags
Medically necessary items are exempt from the clear bag policy after additional screening. This includes insulin pumps, EpiPen carriers, hearing aid cases, mobility devices, and other medical equipment.
Notify security staff in advance if possible. Expect to enter through a designated accessibility gate and allow extra time for inspection.
Diaper bags are permitted under two conditions: they must be clear and meet the 12x6x12 size limit. Opaque diaper bags of any size are prohibited.
The “necessary for infants” exception does not override the bag material or size requirements. If you’re traveling with an infant and a non-compliant diaper bag, use a clear bag instead or plan to use the bag valet service.
Parents with medically complex children sometimes require larger bags for medications and supplies.
Contact SoFi Stadium Guest Services before your visit to arrange accommodations. Documentation may be required.
Extra Security Screening Process
When you bring an exception item like a medical bag or small clutch, security opens and inspects it completely. Expect a thorough check of every pocket and compartment.
This adds 3-5 minutes to entry time, so arrive early if you’re using an exception.
Items inside must comply with prohibited item rules as well. You can’t circumvent the clear bag policy by hiding prohibited items inside an allowed clutch. Security scans the interior.
Bag Valet is located at the NE, NW, SW, and SE corners of SoFi Stadium’s exterior perimeter. The service charges $20 per bag from check-in until shortly after the event concludes. SoFi Cardholders (the stadium’s membership program) check bags free.
Crossbody Bags: What’s Allowed?
Crossbody bags create constant confusion because their appeal (wearable, hands-free, practical) clashes with the size rules. The key distinction: it’s the size that matters, not the style.
What Qualifies as a Crossbody Bag?
A crossbody bag is any bag worn across the chest or shoulder, hanging at the hip. The style includes messenger bags, sling bags, crossbody purses, and hip slings. The style itself is not the determining factor for entry.
What determines entry is whether the bag meets the clear requirement and size limit. A clear crossbody bag measuring 10x5x8 inches is permitted. A non-clear crossbody bag measuring 8x6x6 inches is prohibited unless it’s the specifically approved 4.5×6.5-inch clutch style.
The crossbody strap doesn’t change the measurement. Measure the bag body itself, excluding the strap length. If the body exceeds 12x6x12, it’s prohibited regardless of how you wear it.
Size and Material Requirements
Your crossbody bag must satisfy two conditions simultaneously: the material must be clear plastic, vinyl, or PVC, and the dimensions must not exceed 12 inches by 6 inches by 12 inches. Violating either requirement means denied entry.
Many popular crossbody bags in stores measure 9x7x3 inches or similar, fitting within the limit. However, most designer crossbody bags exceed the width or depth limit. Check the product specs before buying or bringing one to the stadium.
Clear crossbody bags are less stylish than traditional options, so many people wonder about alternatives. The answer is simple: bring a small non-clear clutch (4.5×6.5) instead of a crossbody, or switch to a clear bag for stadium events.
SoFi Stadium Water Bottle Policy
While technically separate from the bag policy, water bottle rules directly impact what you can carry inside, so knowing them prevents confusion at entry gates.
Permitted Bottle Types and Sizes
You may bring one factory-sealed 20-ounce water bottle into SoFi Stadium. The bottle must be sealed (unopened) before entry.
Common examples include Aquafina, Dasani, or store-brand bottled water. Once you enter, you cannot bring opened bottles back outside security and bring them back in.
Check the Chargers or Rams official websites for event-specific water bottle policies, as some special events may have different rules.
Empty, reusable water bottles under 20 ounces are also permitted. This includes metal, plastic, or fabric bottles as long as they’re empty at entry.
SoFi has free water refill stations on multiple concourse levels, so bringing an empty reusable bottle is economical for long events.
Hard-sided water bottles, collapsible bottles, and bottles larger than 20 ounces are prohibited. Vacuum-insulated bottles (Hydro Flask style) are typically allowed if they’re empty and under the size limit, but confirm at your specific gate since policies vary slightly.
Empty vs. Full Bottles
An unopened, sealed 20-ounce factory bottle counts as one item and fits inside your clear bag. An empty reusable bottle takes up more space in your bag but costs nothing to refill at the stadium.
You cannot bring open or partially filled water bottles. Bringing an open bottle of water and intending to refill it at the fountain is not permitted—you must enter with it empty. This rule exists for security screening purposes.
FAQs
Can I bring a belt bag or small crossbody to SoFi Stadium?
Only if it’s clear and measures 12x6x12 inches or smaller. Non-clear belt bags must be the specific 4.5×6.5-inch clutch size. Most fashion belt bags exceed these dimensions, so measure before arriving.
What about clear backpacks for school or hiking?
Clear backpacks over 12x6x12 inches are prohibited. Measuring matters more than the style. Many clear backpacks marketed as stadium-approved actually measure 15x10x8 inches and will be rejected at SoFi gates. Check the manufacturer’s specifications carefully before purchase.
Do I need to bring a bag at all?
No. SoFi actively encourages guests to leave bags at home if possible. Arriving without a bag speeds up entry significantly and reduces security wait times. Bring only what fits in your pockets if that’s an option.
What happens if my bag is slightly over the size limit?
Security will deny entry. There is no flexibility. A 12.5-inch-tall clear bag will be turned away. If you arrive with an oversized bag, you have three options: return to your vehicle, use the bag valet for $20, or check with Guest Services about exception eligibility.
Can I bring a Lululemon belt bag or similar branded small bags?
Branded small bags must still meet the clear bag requirement or the 4.5×6.5-inch clutch exception. Most designer belt bags exceed the clutch size limit and aren’t clear, so they’re prohibited. Always measure and check the material, not the brand name.
Is the clear bag policy the same for concerts as NFL games?
Yes, the policy applies uniformly to all events. Sports, concerts, conventions, and other gatherings at SoFi use the identical clear bag and size rules. The NFL enforces this policy across all stadiums, ensuring consistency.
What if I have a medical bag larger than 12x6x12 inches?
Contact SoFi Stadium Guest Services before your visit at 1-844-SOFI-888 to arrange accommodations. Medical necessity may qualify for an exception with proper documentation. Waiting until gate entry to explain won’t get you through.
Can I bring a purse with a small clear window to show my ID and cards?
No. The entire bag (all panels and sides) must be transparent. A purse with a single clear window is not a clear bag under stadium rules.
Does the bag have to be new or unused?
No, the bag just needs to meet the material and size specifications. A used clear vinyl bag that you’ve brought to other stadiums is fine as long as it’s still transparent and within limits.
What about the difference between “clutch” and “small bag”?
In stadium policy, these terms are used interchangeably. A small clutch is any bag under 4.5×6.5 inches, whether it’s traditional clutch style, a small crossbody, a small shoulder bag, or a wallet on a strap.
If I exceed the bag size limit by less than an inch, will security let me through?
Unlikely. Security uses measuring devices and applies rules consistently. A bag measuring 12.5 inches in any dimension will be rejected, even if the excess is small. Round up your measurements to be safe.
What’s the best clear bag to bring to SoFi Stadium?
Clear vinyl tote bags are the most versatile option. They’re durable, fold flat when empty, and remain transparent even after repeated use. One-gallon freezer bags are a budget-friendly alternative for occasional visits. Clear backpacks work if they measure under 12x6x12 inches, though this size is hard to find. For FIFA World Cup 2026 matches, expect slightly enhanced security protocols, so arriving with a pre-approved clear bag eliminates entry delays.",https://surprisesports.com/football/fifa-world-cup/sofi-stadium-bag-policy/,,Inglewood,United States
