topic,query,title,link,snippet,published,world_cup_match,fetched_at,matched_keyword,content,real_link,scrape_error,city,country
Stadium safety / security,"""fifa world cup 2026"" ""bag policy""",Mercedes-Benz Stadium Bag Policy for FIFA World Cup 2026 - surprisesports,https://news.google.com/rss/articles/CBMijAFBVV95cUxQTWZ3OUxOMVd4Y1U1dXpDbmVoSDg1QUdoanEzSFNFUFJ3YVVvSjVmWk1zLUViZDZFdTFJWWwtZXNKUzgyOFBxejE4Q3F4cWNoVG1IX1dBS21pcFczNzFFcXF2VDZUWFpybXNGT1JjT0UwV2FlOGhVZ0V3RzBVdzVXTDlBZnFXRnhkUHhVQw?oc=5,"<a href=""https://news.google.com/rss/articles/CBMijAFBVV95cUxQTWZ3OUxOMVd4Y1U1dXpDbmVoSDg1QUdoanEzSFNFUFJ3YVVvSjVmWk1zLUViZDZFdTFJWWwtZXNKUzgyOFBxejE4Q3F4cWNoVG1IX1dBS21pcFczNzFFcXF2VDZUWFpybXNGT1JjT0UwV2FlOGhVZ0V3RzBVdzVXTDlBZnFXRnhkUHhVQw?oc=5"" target=""_blank"">Mercedes-Benz Stadium Bag Policy for FIFA World Cup 2026</a>&nbsp;&nbsp;<font color=""#6f6f6f"">surprisesports</font>",2026-02-27,True,2026-03-05 22:58:03.437005,bag policy,"Atlanta is hosting FIFA World Cup 2026, and Mercedes-Benz Stadium will draw fans from around the globe.
Before you arrive at the gates, understand the clear bag policy that governs entry. This isn’t just a stadium preference. It’s a safety standard that FIFA enforces across all tournament venues to manage security efficiently and protect the international crowd.
Knowing what bags pass inspection means avoiding entry delays, missed moments, and the frustration of turning back after traveling to the stadium. Whether you’re a first-time visitor or seasoned supporter, this guide answers every question about what you can bring inside.
Quick Reference: Mercedes-Benz Stadium Bag Policy Compliance Chart
|Bag Type||Size Limit||Material||Status||Notes|
|Clear backpack||12″ × 6″ × 12″||Plastic, vinyl, PVC||✅ Allowed||Transparent frame required|
|Clear fanny pack||12″ × 6″ × 12″||Plastic, vinyl, PVC||✅ Allowed||One-gallon freezer bag alternative|
|Small clutch||4.5″ × 6.5″||Any (opaque OK)||✅ Allowed||Wallet-sized only|
|Diaper bag (clear)||12″ × 6″ × 12″||Plastic, vinyl, PVC||✅ Allowed||Subject to inspection|
|Standard backpack||Any||Any||❌ Prohibited||Even if under size limit|
|Opaque handbag||Over 4.5″ × 6.5″||Any||❌ Prohibited||Must go to storage|
|Rolling luggage||Any||Any||❌ Prohibited||Use Mobile Locker Company|
|Camera bag (non-clear)||Any||Any||❌ Prohibited||Only if transparent and compliant|
Why Clear Bags Are Required for FIFA Security
Clear bags aren’t an inconvenience.
They’re a deliberate safety mechanism that FIFA mandates at all World Cup venues. Unlike typical NFL events at the same stadium, FIFA tournaments require elevated security due to international attendance and the global visibility of the event.
Transparent visibility allows security personnel to inspect bag contents without opening them, which accelerates screening and reduces bottlenecks at entry gates during peak arrival times.
FIFA vs. NFL Security Standards
The difference matters because FIFA operates under distinct international security protocols.
While the same stadium hosts both NFL and soccer events, FIFA implements stricter standards aligned with global safety requirements. Transparent bags let security confirm what’s inside in seconds rather than minutes.
This distinction isn’t just procedural. It reflects how FIFA coordinates security across three countries (USA, Canada, Mexico) and ensures consistent screening regardless of a visitor’s home country or language.
How Clear Bags Accelerate Entry
Security personnel can visually confirm bag contents without hand searches. Metal detectors scan for prohibited items, and pat-downs confirm compliance.
Most fans clear screening in 30 seconds with a compliant bag. Non-compliant bags trigger extended inspections, manual opening, and potential denial.
The sports planning guide for World Cup 2026 emphasizes arriving 90 minutes early to account for screening lines during high-volume events like quarter-final matches.
Airport-Style Screening Explained
Think of stadium security like airport TSA checkpoints. You place your bag on a conveyor belt leading through a metal detector. Staff visually inspect the clear interior. If anything looks questionable, you’ll be asked to explain or remove the item.
This system works only if bags are actually transparent. Bring hand-sized essentials: ID, ticket, phone, wallet. The faster you move through, the more time you have to enjoy the fan experience before kickoff.
Allowed Bag Sizes and Materials
The clear bag policy has two tiers: primary and secondary. Primary bags (clear, large) must meet strict dimensions. Secondary bags (small, non-clear) are allowed only if they stay within clutch size limits.
Clear Bags: 12×6×12 Inches
This is the maximum permitted size for clear plastic, vinyl, or PVC bags.
In centimeters, that’s 30.5 × 15.25 × 30.5 cm.
The specification includes clear backpacks, fanny packs, and cinch bags as long as they fit within these dimensions. Many bags marketed as “stadium-compliant” exceed this limit by a few inches.
Measure yours before game day.
A gallon-sized freezer bag also qualifies if completely clear and under the size threshold.
Small Clutches: 4.5×6.5 Inches
Non-clear bags are allowed only if they don’t exceed this tiny footprint.
This means wallet-sized clutches, small crossbody bags, or minimalist pouches. Think of it as palm-of-your-hand sizing.
Handles and straps are fine as long as the overall dimensions stay under 4.5×6.5 inches. A crossbody clutch worn under your shirt works, though security may ask you to show it’s compliant.
Approved Materials (Plastic, Vinyl, PVC)
Only transparent, flexible materials pass inspection.
Tinted, frosted, or patterned bags are not allowed even if they’re technically see-through. Simple logos on one side are acceptable. Complex graphics that obstruct interior visibility will be denied.
Avoid bags with metallic hardware, rigid frames, or decorative elements that block the view inside. If you can’t see all interior contents from every angle, it fails.
Approved bag materials:
- Clear plastic (most common)
- Vinyl (flexible, durable)
- PVC (rigid clarity, airport-style)
- One-gallon freezer bags (temporary option)
- Transparent backpacks (if under size limit)
Specific Bag Types and Exceptions
Some bags need special consideration, and certain populations have legitimate exceptions to standard rules.
Diaper Bags and Medical Bags
Parents traveling with infants and toddlers can bring clear diaper bags that comply with size policy.
The bag must be clear and meet the 12×6×12 inch limit.
Security will inspect diaper bags just like any other. Formula, baby food, medications, and inhalers are exempted after proper inspection.
Medical equipment bags (oxygen, glucose monitors, EpiPens) receive similar treatment. Arrive early with documentation if you’re carrying specialized medical gear so staff can verify contents without delays.
Non-Clear Bags Rules
The only way to bring an opaque bag is if it stays under 4.5×6.5 inches.
Larger opaque bags mean entry denied, no exceptions.
Some fans ask if they can bring a non-clear bag in addition to a clear bag. The answer is yes, but the non-clear bag must be small enough to fit inside or carry separately while still complying with size limits. You can’t use a large opaque bag as your primary carrier.
Transparency and Hardware Requirements
Every angle of your bag’s interior must be visible without opening it.
Buckles, grommets, or metal décor that conceals interior space will get your bag rejected at the gate. Simpler designs pass faster.
If your bag has opaque side pockets or hidden compartments, it won’t meet the visual inspection standard. Test your bag at home by looking through it from all sides. If you can’t see the entire interior from the outside, security won’t let it through.
Prohibited Items and Restrictions
Some bags are outright banned, and certain items can’t be brought inside regardless of bag type.
Backpacks Not Allowed
Standard backpacks are prohibited.
This applies to school backpacks, hiking packs, and travel daypacks. The one exception: clear backpacks that don’t exceed 12×6×12 inches.
The frame and straps must also be transparent or at least not obstruct the view inside. Most backpacks, even small ones, have opaque frames or padding that makes them non-compliant.
Large Luggage Restrictions
Suitcases, rolling luggage, hard-sided cases, and overnight bags are all banned.
These items create evacuation delays and block sightlines. If you’re traveling from out of town, check your luggage at your hotel or use external storage services before heading to the stadium.
This rule applies regardless of whether luggage is locked or empty.
Item-Specific Bans
Weapons and safety items:
- Explosives, fireworks, flares
- Firearms, ammunition, pellet guns
- Knives, box cutters, sharp objects
- Pepper spray, tear gas, mace
- Tasers, stun guns, cattle prods
Recording and professional equipment:
- Cameras with lenses longer than 6 inches
- Tripods, monopods, selfie sticks
- Drones and remote-controlled devices
- Professional audio recorders
- Go-Pro cameras and mounting equipment
Prohibited substances:
- Alcohol (beer, wine, spirits)
- Illegal drugs and controlled substances
- Loose batteries outside working devices
- Flammable liquids, lighter fluid
- Any explosive or dangerous materials
Other restricted items:
- Noisemakers (vuvuzelas, air horns, whistles)
- Umbrellas of any kind
- Portable chairs, stools, booster seats
- Selfie sticks and pole-mounted items
- Flags larger than 1.5 meters
- Masks that conceal identity
- Tobacco and vaping products
- Glass bottles, aluminum cans
- Any item security deems suspicious
What to Do If Your Bag Doesn’t Comply
You show up with a non-compliant bag.
Security turns you away. You have options.
External Bag Storage Options
The Mobile Locker Company operates fee-based storage just outside the stadium gates.
Their secure lockers accept bags that don’t meet the clear policy. You check in your bag, receive a digital claim ID on your phone, and collect it after the match.
No pre-booking required. First-come, first-serve.
Lockers are available from 2 hours before kickoff until 1.5 hours after the event ends. Contact The Mobile Locker Company for pricing and specific gate locations.
Mobile Locker Company Details
Locations are positioned near Gates 3 and 4 for convenient access before you hit the main security checkpoint.
Digital check-in takes 90 seconds. Staff answers questions on-site. Items left overnight are held, and retrieval is handled via email.
For most matches, this solution costs $10-$15 per bag depending on event size.
Planning Your Stadium Arrival
The stadium’s recommendation is blunt: don’t bring a bag.
It’s the fastest entry path.
If you must bring essentials, pack only ID, ticket, phone, and wallet in a compliant clear bag or small clutch.
Arrive 90 minutes before kickoff. Plan for 20 to 40 minutes of security screening during high-attendance matches like group-stage finals.
Use public transit via MARTA. Take the Blue/Green Line to GWCC/Vine City station (2-block walk to stadium). Or use rideshare to avoid parking delays and stress.
Before You Head to the Stadium
Plan your bag strategy early.
The simplest approach: skip bags entirely. You’ll clear security fastest with just ID, ticket, and phone.
If you prefer to carry essentials, invest in a clear plastic bag under 12×6×12 inches from any retailer. They cost $5-$15.
Measure your bag.
Don’t estimate. Use a measuring tape on width, depth, and height. One inch over the limit means denial.
Test transparency by looking through it from every angle. If you can’t see the entire interior, it won’t pass inspection.
Arrive 90 minutes early.
Security screening during high-attendance matches takes 20 to 40 minutes. You’re competing with thousands of international fans all entering simultaneously.
Early arrival gives you buffer time, access to bag storage if needed, and time to explore the stadium concourse before kickoff.
Know your prohibited items.
Weapons, explosives, large cameras, umbrellas, noisemakers, alcohol, and flammable materials are banned.
These rules apply to everyone, no exceptions.
If your bag doesn’t comply, use Mobile Locker Company.
They operate outside Gates 3 and 4 with secure digital check-in. Cost is typically $10-$15 per event.
Retrieve your bag up to 1.5 hours after the match concludes.
FAQs
Is there a clear bag policy at Mercedes-Benz Stadium for FIFA matches?
Yes. All bags entering the stadium must either be clear plastic, vinyl, or PVC measuring no more than 12×6×12 inches, or non-clear bags under 4.5×6.5 inches. FIFA security protocols require transparent visibility of bag contents.
Can I bring a backpack into the stadium?
No, standard backpacks are prohibited. Clear backpacks that meet the 12×6×12 inch size limit and have transparent frames are the only exception. Opaque backpacks of any size will be denied entry.
What if I bring a bag that doesn’t comply?
Security will turn you away at the gate. The Mobile Locker Company provides fee-based external storage outside the stadium. You can store non-compliant bags and retrieve them after the match.
Are diaper bags allowed?
Yes, diaper bags must be clear and comply with the 12×6×12 inch size policy. Formula, medications, and baby supplies are permitted after security inspection. Arrive early to allow time for additional screening.
What size is a small, non-clear clutch?
Non-clear bags are allowed only if they don’t exceed 4.5×6.5 inches, about palm-of-your-hand size. This qualifies as a wallet-sized clutch or small crossbody bag. Anything larger must be clear.
Can I bring a camera or phone to record?
Personal phones are allowed. Professional cameras with detachable lenses longer than 6 inches are prohibited. Tripods and recording devices are banned. Check stadium policy if you have questions about specific equipment.",https://surprisesports.com/football/fifa-world-cup/mercedes-benz-stadium-bag-policy/,,Atlanta,United States
